{
  "event_id": "PAD-7-1042",
  "kind": "SERVICE_CHECKED_IN",
  "occurred_at": "2026-09-15T19:00:00+08:00",
  "subject_id": "child:K1",
  "version": 3,
  "rule_version": 2,
  "payload": {
    "sessionId": "SX",
    "at": "2026-09-15T19:00:00+08:00",
    "deviceId": "PAD-7",
    "bookingId": "B1"
  }
}
